{
  "version": 1,
  "currentPhase": 1,
  "nodes": [
    {
      "id": "REQ-001",
      "type": "REQ",
      "phase": 1,
      "title": "域",
      "summary": "level=1 根",
      "level": 1,
      "evidenceAnchor": "w-model-dev/references/graph-guide.md:§3=level=1 根",
      "evidenceStatus": "confirmed"
    },
    {
      "id": "REQ-002",
      "type": "REQ",
      "phase": 1,
      "title": "模块",
      "summary": "level=2",
      "level": 2,
      "reqGroup": "REQ-001",
      "evidenceAnchor": "w-model-dev/references/graph-guide.md:§3=level=2",
      "evidenceStatus": "confirmed"
    },
    {
      "id": "REQ-003",
      "type": "REQ",
      "phase": 1,
      "title": "功能",
      "summary": "level=3",
      "level": 3,
      "reqGroup": "REQ-001",
      "evidenceAnchor": "w-model-dev/references/graph-guide.md:§3=level=3",
      "evidenceStatus": "confirmed"
    },
    {
      "id": "REQ-004",
      "type": "REQ",
      "phase": 1,
      "title": "验收",
      "summary": "level=4",
      "level": 4,
      "reqGroup": "REQ-001",
      "evidenceAnchor": "w-model-dev/references/graph-guide.md:§3=level=4",
      "evidenceStatus": "confirmed"
    }
  ],
  "edges": [
    {
      "from": "REQ-001",
      "to": "REQ-002",
      "type": "parent"
    },
    {
      "from": "REQ-002",
      "to": "REQ-003",
      "type": "parent"
    },
    {
      "from": "REQ-003",
      "to": "REQ-004",
      "type": "parent"
    }
  ]
}
