{
  "version": 1,
  "project": "phase2-positive-sample",
  "currentPhase": 2,
  "rootId": "REQ-ROOT",
  "nodes": [
    {
      "id": "EXT-IN-001",
      "type": "EXT-IN",
      "phase": 1,
      "title": "学员请求",
      "summary": "合法外部信息源：学员检索/注册/学习请求",
      "evidenceAnchor": "w-model-dev/references/graph-guide.md:§7=EXT-IN 显式化系统边界源，豁免奇迹判定",
      "evidenceStatus": "confirmed"
    },
    {
      "id": "REQ-ROOT",
      "type": "REQ",
      "phase": 1,
      "title": "在线课程平台",
      "summary": "系统根：无 parent 入边的唯一 REQ 节点（系统对外代理）",
      "level": 1,
      "evidenceAnchor": "w-model-dev/references/graph-guide.md:§3=系统根由 parent 入边为 0 的唯一 REQ 节点担任",
      "evidenceStatus": "confirmed"
    },
    {
      "id": "REQ-101",
      "type": "REQ",
      "phase": 1,
      "title": "课程检索",
      "summary": "level=2 需求模块：按关键字/分类检索课程",
      "level": 2,
      "reqGroup": "REQ-ROOT",
      "evidenceAnchor": "w-model-dev/references/graph-guide.md:§3=level=2 需求模块经 parent 依附 level=1 域",
      "evidenceStatus": "confirmed"
    },
    {
      "id": "REQ-102",
      "type": "REQ",
      "phase": 1,
      "title": "学习进度",
      "summary": "level=2 需求模块：记录并展示学员学习进度",
      "level": 2,
      "reqGroup": "REQ-ROOT",
      "evidenceAnchor": "w-model-dev/references/graph-guide.md:§3=同类型 parent 边属内部分解层级，豁免跨类型层级单调校验",
      "evidenceStatus": "confirmed"
    },
    {
      "id": "SD-001",
      "type": "SD",
      "phase": 2,
      "title": "课程服务子系统",
      "summary": "系统设计模块：课程目录与检索能力",
      "evidenceAnchor": "w-model-dev/references/graph-guide.md:§4=阶段 2 起每个 SD 须有 implements 出边",
      "evidenceStatus": "confirmed"
    },
    {
      "id": "SD-002",
      "type": "SD",
      "phase": 2,
      "title": "学习服务子系统",
      "summary": "系统设计模块：进度记录与回放能力",
      "evidenceAnchor": "w-model-dev/references/graph-guide.md:§4=SD_without_implements=0 为阶段 2 硬约束",
      "evidenceStatus": "confirmed"
    },
    {
      "id": "SD-003",
      "type": "SD",
      "phase": 2,
      "title": "治理与审计子系统",
      "summary": "治理类子系统（governance=true）：横切治理被治理子系统",
      "governance": true,
      "evidenceAnchor": "w-model-dev/references/graph-guide.md:§7=governs 边源须 governance===true 的治理类子系统",
      "evidenceStatus": "confirmed"
    },
    {
      "id": "EXT-OUT-001",
      "type": "EXT-OUT",
      "phase": 1,
      "title": "学员界面与持久化",
      "summary": "合法外部信息汇：界面展示与学习记录落库",
      "evidenceAnchor": "w-model-dev/references/graph-guide.md:§7=EXT-OUT 显式化系统边界汇，豁免黑洞判定",
      "evidenceStatus": "confirmed"
    }
  ],
  "edges": [
    {
      "from": "REQ-ROOT",
      "to": "REQ-101",
      "type": "parent",
      "sourceArtifact": "docs/phase1-requirements/traceability-matrix.md"
    },
    {
      "from": "REQ-ROOT",
      "to": "REQ-102",
      "type": "parent",
      "sourceArtifact": "docs/phase1-requirements/traceability-matrix.md"
    },
    {
      "from": "REQ-ROOT",
      "to": "SD-001",
      "type": "parent",
      "sourceArtifact": "docs/phase2-design/demo-system-design.md"
    },
    {
      "from": "REQ-101",
      "to": "SD-002",
      "type": "parent",
      "sourceArtifact": "docs/phase2-design/demo-system-design.md"
    },
    {
      "from": "REQ-102",
      "to": "SD-003",
      "type": "parent",
      "sourceArtifact": "docs/phase2-design/demo-system-design.md"
    },
    {
      "from": "SD-001",
      "to": "REQ-ROOT",
      "type": "implements",
      "sourceArtifact": "docs/phase2-design/demo-system-design.md"
    },
    {
      "from": "SD-001",
      "to": "REQ-101",
      "type": "implements",
      "sourceArtifact": "docs/phase2-design/demo-system-design.md"
    },
    {
      "from": "SD-002",
      "to": "REQ-ROOT",
      "type": "implements",
      "sourceArtifact": "docs/phase2-design/demo-system-design.md"
    },
    {
      "from": "SD-002",
      "to": "REQ-101",
      "type": "implements",
      "sourceArtifact": "docs/phase2-design/demo-system-design.md"
    },
    {
      "from": "SD-003",
      "to": "REQ-102",
      "type": "implements",
      "sourceArtifact": "docs/phase2-design/demo-system-design.md"
    },
    {
      "from": "EXT-IN-001",
      "to": "REQ-ROOT",
      "type": "produces",
      "sourceArtifact": "docs/phase1-requirements/requirement-spec.md"
    },
    {
      "from": "EXT-IN-001",
      "to": "REQ-101",
      "type": "produces",
      "sourceArtifact": "docs/phase1-requirements/requirement-spec.md"
    },
    {
      "from": "EXT-IN-001",
      "to": "REQ-102",
      "type": "produces",
      "sourceArtifact": "docs/phase1-requirements/requirement-spec.md"
    },
    {
      "from": "REQ-ROOT",
      "to": "SD-001",
      "type": "produces",
      "sourceArtifact": "docs/phase2-design/demo-system-design.md"
    },
    {
      "from": "REQ-101",
      "to": "SD-002",
      "type": "produces",
      "sourceArtifact": "docs/phase2-design/demo-system-design.md"
    },
    {
      "from": "REQ-102",
      "to": "SD-003",
      "type": "produces",
      "sourceArtifact": "docs/phase2-design/demo-system-design.md"
    },
    {
      "from": "SD-001",
      "to": "SD-002",
      "type": "produces",
      "sourceArtifact": "docs/phase2-design/demo-system-design.md"
    },
    {
      "from": "SD-002",
      "to": "SD-003",
      "type": "produces",
      "sourceArtifact": "docs/phase2-design/demo-system-design.md"
    },
    {
      "from": "SD-003",
      "to": "EXT-OUT-001",
      "type": "produces",
      "sourceArtifact": "docs/phase2-design/demo-system-design.md"
    },
    {
      "from": "SD-001",
      "to": "SD-002",
      "type": "depends-on",
      "sourceArtifact": "docs/phase2-design/demo-system-design.md"
    },
    {
      "from": "SD-002",
      "to": "SD-003",
      "type": "depends-on",
      "sourceArtifact": "docs/phase2-design/demo-system-design.md"
    },
    {
      "from": "SD-001",
      "to": "SD-003",
      "type": "depends-on",
      "sourceArtifact": "docs/phase2-design/demo-system-design.md"
    },
    {
      "from": "SD-002",
      "to": "SD-001",
      "type": "collaborates-with",
      "sourceArtifact": "docs/phase2-design/demo-system-design.md"
    },
    {
      "from": "SD-003",
      "to": "SD-001",
      "type": "governs",
      "sourceArtifact": "docs/phase2-design/demo-system-design.md"
    },
    {
      "from": "SD-003",
      "to": "SD-002",
      "type": "governs",
      "sourceArtifact": "docs/phase2-design/demo-system-design.md"
    }
  ]
}
