{
  "version": 1,
  "currentPhase": 1,
  "nodes": [
    {
      "id": "REQ-001",
      "type": "REQ",
      "phase": 1,
      "title": "用户管理域",
      "summary": "level=1 domain",
      "level": 1,
      "evidenceAnchor": "docs/phase1-requirements/requirement-spec.md:§4.2=登录需密码策略（用户原话）",
      "evidenceStatus": "confirmed"
    },
    {
      "id": "REQ-002",
      "type": "REQ",
      "phase": 1,
      "title": "注册模块",
      "summary": "level=2 module",
      "level": 2,
      "reqGroup": "REQ-001",
      "evidenceAnchor": "w-model-dev/references/graph-guide.md:§3=level=2 module",
      "evidenceStatus": "confirmed"
    },
    {
      "id": "REQ-003",
      "type": "REQ",
      "phase": 1,
      "title": "邮箱注册功能",
      "summary": "level=3 feature",
      "level": 3,
      "reqGroup": "REQ-001",
      "evidenceAnchor": "w-model-dev/references/graph-guide.md:§3=level=3 feature",
      "evidenceStatus": "confirmed"
    },
    {
      "id": "REQ-004",
      "type": "REQ",
      "phase": 1,
      "title": "邮箱格式校验",
      "summary": "level=4 acceptance",
      "level": 4,
      "reqGroup": "REQ-001",
      "evidenceAnchor": "w-model-dev/references/graph-guide.md:§3=level=4 acceptance",
      "evidenceStatus": "confirmed"
    },
    {
      "id": "REQ-005",
      "type": "REQ",
      "phase": 1,
      "title": "密码强度校验",
      "summary": "level=4 acceptance",
      "level": 4,
      "reqGroup": "REQ-001",
      "evidenceAnchor": "w-model-dev/references/graph-guide.md:§3=level=4 acceptance",
      "evidenceStatus": "confirmed"
    }
  ],
  "edges": [
    {
      "from": "REQ-001",
      "to": "REQ-002",
      "type": "parent"
    },
    {
      "from": "REQ-002",
      "to": "REQ-003",
      "type": "parent"
    },
    {
      "from": "REQ-003",
      "to": "REQ-004",
      "type": "parent"
    },
    {
      "from": "REQ-003",
      "to": "REQ-005",
      "type": "parent"
    }
  ]
}
